{
  "$schema": "https://json-schema.org/draft/2020-12/schema",
  "$id": "aliases.schema.json",
  "title": "낱말표: 이용자가 칠 말을 화면 말·자료에 잇는 표 (AI 아님, D74·D83). 사전 검색 동의어(searchSynonyms, T35)와 직접 쓰기 낱말(options·yesNo·aiNames·toolHints·gaps, T36, docs/review/v3/input.md 6·9.2절)이 한 파일에 있다. npm run words는 이 파일의 열쇠를 보지 않고 message 칸만 본다. 말 앞의 '='는 '어절 하나 전체가 같을 때만'이고, 한 글자 말은 '='가 있어야 한다. 한 칸에서 함께 찾는 말끼리 겹치면 npm run validate가 막는다",
  "type": "object",
  "required": ["version", "searchSynonyms", "options", "yesNo", "aiNames", "toolHints", "gaps"],
  "additionalProperties": false,
  "$defs": {
    "words": {
      "type": "array",
      "minItems": 1,
      "uniqueItems": true,
      "items": { "type": "string", "minLength": 1 },
      "description": "이용자가 칠 말. 정규화(NFKC·소문자·글자와 숫자와 +·#만)하고 띄어쓰기를 뺀 꼴로 견준다. '='로 시작하면 어절 하나 전체가 같을 때만"
    },
    "entry": {
      "type": "object",
      "additionalProperties": false,
      "required": ["id", "aliases"],
      "properties": {
        "id": { "$ref": "defs.schema.json#/$defs/id" },
        "aliases": { "$ref": "#/$defs/words" }
      }
    }
  },
  "properties": {
    "version": { "const": 1 },
    "searchSynonyms": {
      "type": "array",
      "minItems": 1,
      "description": "사전·도구 모음 검색 색인을 만들 때 펼친다 (src/lib/search-index.ts, docs/review/v3/brief.md 3.5절). 화면 문구에서 쓰지 않는 말(테마·폰트·가이드…)도 검색어로는 받는다",
      "items": {
        "type": "object",
        "additionalProperties": false,
        "required": ["id", "aliases", "to"],
        "properties": {
          "id": { "$ref": "defs.schema.json#/$defs/id" },
          "aliases": {
            "type": "array",
            "minItems": 1,
            "uniqueItems": true,
            "items": { "type": "string", "minLength": 2 },
            "description": "이용자가 칠 말. 띄어쓰기·대소문자를 뺀 꼴이 2자 이상이고, 다른 줄의 말과 겹치지 않는다(npm run validate). 띄어 쓴 말은 붙여 쓴 꼴도 함께 찾힌다"
          },
          "to": {
            "type": "array",
            "minItems": 1,
            "uniqueItems": true,
            "items": { "type": "string", "minLength": 1 },
            "description": "대신 찾을 화면 말·문서 이름. 용어 카드·풀이 용어·에러 안내·도구의 이름이나 다른 이름과 띄어쓰기·대소문자를 빼고 같으면 그 문서에 aliases가 붙는다. 아직 없는 화면(만들기 안내·디자인 둘러보기 등)의 이름도 미리 적어 둔다: 그 문서가 색인에 들어오면 저절로 붙는다"
          }
        }
      }
    },
    "options": {
      "type": "object",
      "description": "질문 id → 보기마다 낱말 (직접 쓰기의 '가까운 보기', input.md 6.2·6.3절). 보기 id는 그 질문에 있고 '모르겠어요'·'직접 쓰기'가 아니다. 예·아니요 질문(yesNo.topics)과 q.ai(aiNames)는 여기에 두지 않는다",
      "propertyNames": { "$ref": "defs.schema.json#/$defs/questionId" },
      "additionalProperties": { "type": "array", "minItems": 1, "items": { "$ref": "#/$defs/entry" } }
    },
    "yesNo": {
      "type": "object",
      "additionalProperties": false,
      "required": ["topics", "answers", "negAfter", "negWindow"],
      "description": "예·아니요 질문 읽기 (input.md 6.4·6.5절): 아니요 말이나 부정된 주제어 → 아니요, 모름 말 → 모르겠어요, 아마 말 → 아마 그럴 거예요, 예 말이나 주제어 → 네",
      "properties": {
        "topics": {
          "type": "object",
          "description": "예·아니요 질문 id → 그 질문의 주제어",
          "propertyNames": { "$ref": "defs.schema.json#/$defs/questionId" },
          "additionalProperties": { "$ref": "#/$defs/words" }
        },
        "answers": {
          "type": "array",
          "minItems": 4,
          "maxItems": 4,
          "description": "공통 말 넷. 적힌 순서대로 정한다(아니요 → 모르겠어요 → 아마 → 네). id는 예·아니요 질문의 보기 id",
          "items": {
            "type": "object",
            "additionalProperties": false,
            "required": ["id", "aliases"],
            "properties": {
              "id": { "enum": ["no", "unknown", "maybe", "yes"] },
              "aliases": { "$ref": "#/$defs/words" }
            }
          }
        },
        "negAfter": {
          "type": "array",
          "minItems": 1,
          "uniqueItems": true,
          "items": { "type": "string", "minLength": 1 },
          "description": "주제어 바로 뒤에 오면 그 주제어를 '아니요' 쪽 증거로 바꾸는 부정 조각. 열쇠가 아니라 글 조각이라 한 글자도 된다"
        },
        "negWindow": { "type": "integer", "minimum": 1, "maximum": 20, "description": "부정 조각을 볼 거리 (공백 뺀 글자 수)" }
      }
    },
    "aiNames": {
      "type": "array",
      "description": "q.ai 직접 쓰기 읽기 (input.md 5.5절): 에이전트 이름 → 코딩 에이전트, 빌더 이름 → 웹에서 만드는 도구, 유료 말 → 유료 AI 구독, 채팅 이름이나 무료 말 → 무료 AI 채팅",
      "items": {
        "type": "object",
        "additionalProperties": false,
        "required": ["id", "aliases"],
        "properties": {
          "id": { "enum": ["agent", "builder", "chat", "paid", "free"] },
          "aliases": { "$ref": "#/$defs/words" }
        }
      }
    },
    "toolHints": {
      "type": "array",
      "description": "목록에 없는 도구 이름 짐작 (설계서 7.3·7.5절): 진열 상품 id(product) 또는 갈래(capability + domain). 진열 상품의 공식 이름은 따로 적지 않아도 찾고, 여기에는 한글 표기·다른 이름만 둔다",
      "items": {
        "type": "object",
        "additionalProperties": false,
        "required": ["id", "aliases"],
        "properties": {
          "id": { "$ref": "defs.schema.json#/$defs/id" },
          "aliases": { "$ref": "#/$defs/words" },
          "product": { "$ref": "defs.schema.json#/$defs/id", "description": "이미 목록에 있는 도구 (products.json id)" },
          "capability": { "$ref": "defs.schema.json#/$defs/capability", "description": "같은 일을 하는 갈래의 기능" },
          "domain": { "type": "string", "pattern": "^domain\\.[a-z0-9-]+$", "description": "갈래의 분야 (외부 데이터일 때)" }
        },
        "oneOf": [
          { "required": ["product"], "not": { "anyOf": [{ "required": ["capability"] }, { "required": ["domain"] }] } },
          { "required": ["capability"], "not": { "required": ["product"] } }
        ]
      }
    },
    "gaps": {
      "type": "array",
      "description": "코드쇼퍼가 아직 못 하는 바람 (input.md 6.8절). 찾으면 화면이 숨기지 않고 말하고(message), 엔진은 조사 카드 research.gap-<id>를 더한다",
      "items": {
        "type": "object",
        "additionalProperties": false,
        "required": ["id", "aliases", "where", "message"],
        "properties": {
          "id": { "$ref": "defs.schema.json#/$defs/id" },
          "aliases": { "$ref": "#/$defs/words" },
          "where": {
            "type": "array",
            "minItems": 1,
            "uniqueItems": true,
            "description": "찾는 자리: 질문 id(그 질문의 직접 쓰기), line(마지막 한 줄), tool(목록에 없는 도구 이름). q.ai에서는 찾지 않는다",
            "items": { "anyOf": [{ "$ref": "defs.schema.json#/$defs/questionId" }, { "enum": ["line", "tool"] }] }
          },
          "message": { "type": "string", "minLength": 1, "description": "화면 알림 한 줄 (해요체, npm run words가 본다)" }
        }
      }
    }
  }
}
